"tweet_id","in_reply_to_status_id","in_reply_to_user_id","timestamp","source","text","retweeted_status_id","retweeted_status_user_id","retweeted_status_timestamp","expanded_urls"
"649726360273842176","","","2015-10-01 23:23:30 +0000","<a href=""http://twitter.com"" rel=""nofollow"">Twitter Web Client</a>","Doh, the defaults weren't getting applied to new goals (was using default defaults instead of adjusted defaults) #bugfix in reminders revamp","","","",""
"649511965212061696","","","2015-10-01 09:11:34 +0000","<a href=""http://twitter.com"" rel=""nofollow"">Twitter Web Client</a>","Autodata vs manual goal reminders had ""reply w/ new data"" in the subject backwards #bugfix (&amp; briefly broke the ""N hours"" in subject lines)","","","",""
"649489827155415040","","","2015-10-01 07:43:36 +0000","<a href=""http://twitter.com"" rel=""nofollow"">Twitter Web Client</a>","Reminders Revamp 10 of N: Zeno SMS messages now tell you the number of hours left to your deadline","","","",""
"649489758008160257","","","2015-10-01 07:43:19 +0000","<a href=""http://twitter.com"" rel=""nofollow"">Twitter Web Client</a>","Changing your deadline now won't let you insta-derail yourself on an eep day, in addition to not letting you snooze w/in 6 hours #bugfix","","","",""
"649489681629876224","","","2015-10-01 07:43:01 +0000","<a href=""http://twitter.com"" rel=""nofollow"">Twitter Web Client</a>","Important #bugfix for weightloss/inbox goals where zeno polling would fail to happen if you moved into the red after zeno start time","","","",""
"649489626583797760","","","2015-10-01 07:42:48 +0000","<a href=""http://twitter.com"" rel=""nofollow"">Twitter Web Client</a>","Reminders Revamp 9 of N: Zeno polling start time no longer restricted to 3am-11:59pm. Now anything in the 24 hours pre deadline (sorta).","","","",""
"649489562440327168","","","2015-10-01 07:42:33 +0000","<a href=""http://twitter.com"" rel=""nofollow"">Twitter Web Client</a>","Reminders Revamp 8 of N: The SMS bot now does zeno polling (premium only; grandfathered original SMS users from before we announced this)","","","",""
"649469919533203457","","","2015-10-01 06:24:30 +0000","<a href=""http://twitter.com"" rel=""nofollow"">Twitter Web Client</a>","Reminders Revamp 7 of N: Single setting for SMS vs email (premium only) means less confusion w/ enabling SMS for each goal","","","",""
"649469872250880000","","","2015-10-01 06:24:18 +0000","<a href=""http://twitter.com"" rel=""nofollow"">Twitter Web Client</a>","Reminders Revamp 6 of N: Decoupled beemail from reminders a bit more in that you can say ""never"" to beemails w/out stopping all reminders","","","",""
"649469827216609284","","","2015-10-01 06:24:08 +0000","<a href=""http://twitter.com"" rel=""nofollow"">Twitter Web Client</a>","Now using html emails for the alerts (though we're barely taking advantage: links instead of raw URLs, bullets) Also: bugfixes w/ email body","","","",""
"649357551817986048","","","2015-09-30 22:57:59 +0000","<a href=""http://twitter.com"" rel=""nofollow"">Twitter Web Client</a>","Reminders Revamp 5 of N: To turn reminders off altogether: either set alert start time a minute before deadline or set days lead time to -1","","","",""
"649357383353761792","","","2015-09-30 22:57:19 +0000","<a href=""http://twitter.com"" rel=""nofollow"">Twitter Web Client</a>","Lock icons on pledge cap &amp; no-mercy if they inherit from global defaults (cumbersome but at least no confusion about where to set them)","","","",""
"649357320175026177","","","2015-09-30 22:57:04 +0000","<a href=""http://twitter.com"" rel=""nofollow"">Twitter Web Client</a>","Sort of part of the reminders revamp: we also now have global defaults for pledge cap and for whether to do no-mercy derailments","","","",""
"649357208862396416","","","2015-09-30 22:56:37 +0000","<a href=""http://twitter.com"" rel=""nofollow"">Twitter Web Client</a>","Reminders Revamp 4 of N: Global defaults for reminder settings! And for each goal you can choose to inherit from defaults or not","","","",""
"649357122988171264","","","2015-09-30 22:56:17 +0000","<a href=""http://twitter.com"" rel=""nofollow"">Twitter Web Client</a>","Reminders Revamp 3 of N: You now have more control over alerts for Do Less goals (though some confusion remains re: what ""safe days"" means)","","","",""
"649357051173343232","","","2015-09-30 22:56:00 +0000","<a href=""http://twitter.com"" rel=""nofollow"">Twitter Web Client</a>","Reminders Revamp 2 of N: Now possible to have *only* emergency day alerts (set days lead time to 0, the default), w/o wrong lane alerts too","","","",""
"649356413257433088","","","2015-09-30 22:53:28 +0000","<a href=""http://twitter.com"" rel=""nofollow"">Twitter Web Client</a>","Reminders Revamp! Huge simplification of reminder settings. Each goal has 3 relevant settings: zeno start time, days lead time, deadline","","","",""
"649000469973438464","","","2015-09-29 23:19:04 +0000","<a href=""http://twitter.com"" rel=""nofollow"">Twitter Web Client</a>","If you derail on the day that your goal is scheduled to archive, the archiving now always happens first (actually just midnight prev night)","","","",""
"648633597247655936","","","2015-09-28 23:01:15 +0000","<a href=""http://twitter.com"" rel=""nofollow"">Twitter Web Client</a>","Archiving now happens at the min of {Akrasia horizon, Goal date}. Which also means insta-archive for completed (but not frozen) goals.","","","",""
"647943919796260865","","","2015-09-27 01:20:43 +0000","<a href=""http://twitter.com"" rel=""nofollow"">Twitter Web Client</a>","Fixed caching of the recent datapoints so if you set your goal units to/from ""hours"" the time-based display will happen right away #bugfix","","","",""
"647848718088077312","","","2015-09-26 19:02:25 +0000","<a href=""http://twitter.com"" rel=""nofollow"">Twitter Web Client</a>","Moved rate units to basic settings and exposed goal units there (now that we actually use goal units for something)","","","",""
"647550823837274116","","","2015-09-25 23:18:41 +0000","<a href=""http://twitter.com"" rel=""nofollow"">Twitter Web Client</a>","For goals where we're pretty sure it's measuring time (goal units = ""hours"") show the recent datapoints as HH:MM:SS not fractional hours","","","",""
"647176605362552832","","","2015-09-24 22:31:41 +0000","<a href=""http://twitter.com"" rel=""nofollow"">Twitter Web Client</a>","On front page, updated ""guaranteed fresh"" link, hovertext for that &amp; main navigation links, don't open blog in new tab, &amp; IFTTT macro bugfix","","","",""
"646830919525863424","","","2015-09-23 23:38:03 +0000","<a href=""http://twitter.com"" rel=""nofollow"">Twitter Web Client</a>","We now support arbitrary deadlines for @Withings goals!","","","",""
"646463564107001856","","","2015-09-22 23:18:19 +0000","<a href=""http://twitter.com"" rel=""nofollow"">Twitter Web Client</a>","We now support arbitrary deadlines for @trello goals!","","","",""
"646093828768731137","","","2015-09-21 22:49:07 +0000","<a href=""http://twitter.com"" rel=""nofollow"">Twitter Web Client</a>","New @IFTTT macro for recipes that send data to @bmndr: PROD[] (as in product, as in multiplying) http://t.co/QGmZRyjKak","","","","http://forum.beeminder.com/t/ifttt-macros/804"
"644990476949389312","","","2015-09-18 21:44:47 +0000","<a href=""http://twitter.com"" rel=""nofollow"">Twitter Web Client</a>","Added new Q's to http://t.co/nhJdyYhflb (blog stuff, integrations) &amp; link to http://t.co/6EhwkB4apK &amp; fixed syntax errors w/ other links","","","","http://beeminder.com/faq,http://blog.beeminder.com/perverse"
"644982799791816704","","","2015-09-18 21:14:17 +0000","<a href=""http://twitter.com"" rel=""nofollow"">Twitter Web Client</a>","Added more tooltips in Terrifyingly Advanced Settings. Unclear whether the terror level went up or down. #mini","","","",""
"644949112039739392","","","2015-09-18 19:00:25 +0000","<a href=""http://twitter.com"" rel=""nofollow"">Twitter Web Client</a>","We now support arbitrary deadlines for @codeschool goals!","","","",""
"644656279420469248","","","2015-09-17 23:36:48 +0000","<a href=""http://twitter.com"" rel=""nofollow"">Twitter Web Client</a>","Expose the integery parameter for custom goals (even though it doesn't do much but change how some bare min etc numbers are displayed) #mini","","","",""
"644268727035301888","","","2015-09-16 21:56:49 +0000","<a href=""http://twitter.com"" rel=""nofollow"">Twitter Web Client</a>","Hitting Beeminder's refresh button right after midnight no longer derails you if a fetch from the previous day is still queued up. #bugfix","","","",""
"643863829714202624","","","2015-09-15 19:07:54 +0000","<a href=""http://twitter.com"" rel=""nofollow"">Twitter Web Client</a>","Improvements to http://t.co/CBLYFQ695g like better links, hovertext, explanation of derailment in ""How Beeminder works"". HT Bill Adams","","","","http://beeminder.com/overview"
"643565222297403392","","","2015-09-14 23:21:20 +0000","<a href=""http://twitter.com"" rel=""nofollow"">Twitter Web Client</a>","We were sometimes getting the date wrong for @duolingo data with non-midnight deadlines when fetched via Beeminder's refresh button. #bugfix","","","",""
"643146718268141570","","","2015-09-13 19:38:21 +0000","<a href=""http://twitter.com"" rel=""nofollow"">Twitter Web Client</a>","Fixed help text tooltip for ""Due By / Hard Cap By"" table to tailor it for the case of Do Less goals. HT David Storrs https://t.co/81anZy6Kkg","","","","https://www.facebook.com/profile.php?id=100007318037266"
"642795356757975040","","","2015-09-12 20:22:10 +0000","<a href=""http://twitter.com"" rel=""nofollow"">Twitter Web Client</a>","Background job (that checks for Garmin data that failed to push) wasn't checking for valid auth. Caused a few cases of missing data. #bugfix","","","",""
"642122303375970304","","","2015-09-10 23:47:41 +0000","<a href=""http://twitter.com"" rel=""nofollow"">Twitter Web Client</a>","The ""bare min / hard cap"" header above the graph now says the right thing for Rationing goals (metrics you want to go down but not too fast)","","","",""
"642120445924241408","","","2015-09-10 23:40:18 +0000","<a href=""http://twitter.com"" rel=""nofollow"">Twitter Web Client</a>","Added new FAQ item about Rarely Asked Questions, with lots of links to ""Beeminder around the internet"". http://t.co/nhJdyYhflb #mini","","","","http://beeminder.com/faq"
"641486918606155777","","","2015-09-09 05:42:54 +0000","<a href=""http://twitter.com"" rel=""nofollow"">Twitter Web Client</a>","RunKeeper goals can now have arbitrary deadlines!","","","",""
"641486833931583488","","","2015-09-09 05:42:34 +0000","<a href=""http://twitter.com"" rel=""nofollow"">Twitter Web Client</a>","Deadlines can now be as early as 7am! And added explanation to hopefully mitigate confusion regarding earlybird vs nightowl deadlines.","","","",""
"641185526670692352","","","2015-09-08 09:45:16 +0000","<a href=""http://twitter.com"" rel=""nofollow"">Twitter Web Client</a>","Fixes to the ""Due By"" / ""Hard Cap By"" table to always use the right heading and ""total"" vs ""value"" (for auto-summing or not) as column label","","","",""
"640815233896869889","","","2015-09-07 09:13:52 +0000","<a href=""http://twitter.com"" rel=""nofollow"">Twitter Web Client</a>","Scootched gryffin closer in Habitica logo to make collage work. Added daystamps to all Datapoint examples in http://t.co/e0pAMoXjIf #mini Ã—2","","","","http://beeminder.com/api"
"640376622634262530","","","2015-09-06 04:10:59 +0000","<a href=""http://twitter.com"" rel=""nofollow"">Twitter Web Client</a>","Yesterday's UVI broke the workaround for changing deadlines on IFTTT/Zapier goals so we fixed that. You can change IFTTT/Zap deadlines now.","","","",""
"640056849144778752","","","2015-09-05 07:00:19 +0000","<a href=""http://twitter.com"" rel=""nofollow"">Twitter Web Client</a>","Weaselproofed goals now also don't let you change their data source back to manual. People complained about us letting them weasel that way.","","","",""
"639687971021590528","","","2015-09-04 06:34:31 +0000","<a href=""http://twitter.com"" rel=""nofollow"">Twitter Web Client</a>","Fixed broken images after HabitRPGâ†’Habitica transition. Also updated API docs to mention the daystamp attribute of the Datapoint resource.","","","",""
"639310325595017216","","","2015-09-03 05:33:54 +0000","<a href=""http://twitter.com"" rel=""nofollow"">Twitter Web Client</a>","Added a warning and disabled rescaling of graphs with automatic data sources (can't rescale the graph without rescaling incoming data!)","","","",""
"638956894682394625","","","2015-09-02 06:09:29 +0000","<a href=""http://twitter.com"" rel=""nofollow"">Twitter Web Client</a>","Changed the subject lines for zeno polling emails to give the deadline instead of ""in 0 days""","","","",""
"638568090284888064","","","2015-09-01 04:24:31 +0000","<a href=""http://twitter.com"" rel=""nofollow"">Twitter Web Client</a>","API now gives permissions error if try to change slug (premium only) instead of silent failure #bugfix HT Chris of http://t.co/XOzB2DTkfl","","","","http://blog.openendings.net"
"638259771276046340","","","2015-08-31 07:59:22 +0000","<a href=""http://twitter.com"" rel=""nofollow"">Twitter Web Client</a>","Beeminder now uses @habitica's new name and logo! (Previously HabitRPG) Special thanks to @lady_alys","","","",""
"637127676742909954","","","2015-08-28 05:00:50 +0000","<a href=""http://twitter.com"" rel=""nofollow"">Twitter Web Client</a>","Were accidentally requesting non-https version of useronboard widget which caused warnings, plus conditionally include it cuz faster #bugfix","","","",""
"636784546508238849","","","2015-08-27 06:17:21 +0000","<a href=""http://twitter.com"" rel=""nofollow"">Twitter Web Client</a>","Clarified error message and outlined the errored field in red in reset form when you don't give the reset value for the graph #bugfix","","","",""
"636783197204836352","","","2015-08-27 06:11:59 +0000","<a href=""http://twitter.com"" rel=""nofollow"">Twitter Web Client</a>","And on the website, goals in an error state (eg no data) gave an embarrassed bee error (500) if you tried to dial/restart them #mini #bugfix","","","",""
"636783108675629056","","","2015-08-27 06:11:38 +0000","<a href=""http://twitter.com"" rel=""nofollow"">Twitter Web Client</a>","We no longer give a 500 error when you specify roadall in the API on a goal currently in an error state (Beebrain). #bugfix HT @chipmanaged","","","",""
"636071381298384896","","","2015-08-25 07:03:29 +0000","<a href=""http://twitter.com"" rel=""nofollow"">Twitter Web Client</a>","Another #bugfix: if you tried to submit bad data in quick-add and *then* tried to navigate away, the warning would fail to happen","","","",""
"636071297680707584","","","2015-08-25 07:03:09 +0000","<a href=""http://twitter.com"" rel=""nofollow"">Twitter Web Client</a>","Oops, just selecting goal in quick-add box shouldn't trigger the ""are you sure you want to navigate away w/out submitting"" warning #bugfix","","","",""
"635724177966653440","","","2015-08-24 08:03:49 +0000","<a href=""http://twitter.com"" rel=""nofollow"">Twitter Web Client</a>","If you forget to hit submit on the quick-add form (right side of goal gallery) it now actually warns you. #bugfix Cf https://t.co/MsAvM4XuGQ","","","","https://twitter.com/beemuvi/status/476413103765073920"
"635336064735928320","","","2015-08-23 06:21:36 +0000","<a href=""http://twitter.com"" rel=""nofollow"">Twitter Web Client</a>","Too many people not understanding the week delay in archiving goals so we made the pop-up pop up when you first press Archive, to explain","","","",""
"634982755726585856","","","2015-08-22 06:57:41 +0000","<a href=""http://twitter.com"" rel=""nofollow"">Twitter Web Client</a>","We messed up grandfathering certain SMS users such that they couldn't update their user info at all (eg, changing a password) #bugfix","","","",""
"634622487486005249","","","2015-08-21 07:06:06 +0000","<a href=""http://twitter.com"" rel=""nofollow"">Twitter Web Client</a>","""Multisport"" activities from @Garmin were causing duplicate distances to be logged so now we ignore those. HT @notspelledright #bugfix","","","",""
"634225631379615744","","","2015-08-20 04:49:08 +0000","<a href=""http://twitter.com"" rel=""nofollow"">Twitter Web Client</a>","Our @IFTTT datapoint-added trigger sometimes triggered multiple times for same datapoint. #bugfix w/ updating flag for when we last checked","","","",""
"633912992120205312","","","2015-08-19 08:06:49 +0000","<a href=""http://twitter.com"" rel=""nofollow"">Twitter Web Client</a>","If you signed up for Beeminder &amp; didn't fill out a required field or gave a bad email address, etc, we'd barf a 500 error at you. #bugfix","","","",""
"633485820700303360","","","2015-08-18 03:49:23 +0000","<a href=""http://twitter.com"" rel=""nofollow"">Twitter Web Client</a>","Our @Garmin integration was failing on manual activities w/ no distance specified (for goals tracking distance) #bugfix","","","",""
"633158735142211584","","","2015-08-17 06:09:40 +0000","<a href=""http://twitter.com"" rel=""nofollow"">Twitter Web Client</a>","Fixed the bug in the API that made the Goal's ""datapoints"" parameter expect the string ""true"" instead of the JSON boolean true. #bugfix","","","",""
"632722848348565504","","","2015-08-16 01:17:37 +0000","<a href=""http://twitter.com"" rel=""nofollow"">Twitter Web Client</a>","The goal progess box in the sidebar is now collapsible, with the Archive button above it instead of inside it. #mini HT Justin Kwok","","","",""
"632473467493986304","","","2015-08-15 08:46:40 +0000","<a href=""http://twitter.com"" rel=""nofollow"">Twitter Web Client</a>","Oldie: IFTTT error emails were missing the name of the goal in error (not applicable to 'any goal' type triggers) #mini #bugfix","","","",""
"632104092245065728","","","2015-08-14 08:18:54 +0000","<a href=""http://twitter.com"" rel=""nofollow"">Twitter Web Client</a>","Configurable Retroratchet is now free! (Existing Bee Lite subscribers, we'll email you tomorrow about this and another change to Bee Lite.)","","","",""
"631706393385533441","","","2015-08-13 05:58:35 +0000","<a href=""http://twitter.com"" rel=""nofollow"">Twitter Web Client</a>","New warning when scheduling a break: ""You have Pessimistic Presumptive Reports turned on for this Do Less goal. Careful they don't...""","","","",""
"630956819649658880","","","2015-08-11 04:20:03 +0000","<a href=""http://twitter.com"" rel=""nofollow"">Twitter Web Client</a>","No longer requiring the datapoint value when doing an update to the datapoint via the API (ie, you can let it default to its existing value)","","","",""
"630956718340476928","","","2015-08-11 04:19:38 +0000","<a href=""http://twitter.com"" rel=""nofollow"">Twitter Web Client</a>","Added ""yaxis"" and ""nomercy"" to the API. Also fixed asterisks accidentally getting interpreted as markdown on http://t.co/e0pAMoXjIf","","","","http://beeminder.com/api"
"629578453935722497","","","2015-08-07 09:02:55 +0000","<a href=""http://twitter.com"" rel=""nofollow"">Twitter Web Client</a>","Now for @fitbit &amp; @Withings you can use x-min to adjust the plot range and see imported data (new goals only; fixing existing ones soon)","","","",""
"629577807824224256","","","2015-08-07 09:00:21 +0000","<a href=""http://twitter.com"" rel=""nofollow"">Twitter Web Client</a>","We put user-initiated autodata fetches on a higher priority queue, and less infinibee buzzing for background autodata fetches","","","",""
"629577530027020289","","","2015-08-07 08:59:14 +0000","<a href=""http://twitter.com"" rel=""nofollow"">Twitter Web Client</a>","We now retry GmailZero, RunKeeper autodata fetches if they time out &amp; Prepended [initday,initval,0] row to ""fullroad"" (API) HT @instigate_it","","","",""
"629211816938205184","","","2015-08-06 08:46:02 +0000","<a href=""http://twitter.com"" rel=""nofollow"">Twitter Web Client</a>","Workaround (""try refreshing page"") for retroratchet not noticing new data added; base ""90% variance"" only on data since YBR start. #mini Ã—2","","","",""
"629205747922964480","","","2015-08-06 08:21:55 +0000","<a href=""http://twitter.com"" rel=""nofollow"">Twitter Web Client</a>","Added the goal attribute ""fullroad"" to the API (Plus documentation fixes like list of ""skinny"" attributes) http://t.co/e0pAMoXjIf","","","","http://beeminder.com/api"
"628375709111549952","","","2015-08-04 01:23:38 +0000","<a href=""http://twitter.com"" rel=""nofollow"">Twitter Web Client</a>","Now give an error instead of letting you shoot yourself in the foot w/ a custom goal that has both odometer and auto-summing set true. #mini","","","",""
"628375481381838848","","","2015-08-04 01:22:44 +0000","<a href=""http://twitter.com"" rel=""nofollow"">Twitter Web Client</a>","Our @tagtm integration now understands Beeminder deadlines! (Our TagTime integration is, however, still kludgetastic, involving perl+xterms)","","","",""
"628040446376194048","","","2015-08-03 03:11:25 +0000","<a href=""http://twitter.com"" rel=""nofollow"">Twitter Web Client</a>","A bug in some ""proper replies"" was causing mailgun to retry messages it thought had failed, causing us to add duplicate datapoints. #bugfix","","","",""
"627653229585653761","","","2015-08-02 01:32:45 +0000","<a href=""http://twitter.com"" rel=""nofollow"">Twitter Web Client</a>","When forcing you to pledge (cuz no freebees) on a new @fitbit goal we were failing to redirect to your goal page after creating it. #bugfix","","","",""
"627314666838994944","","","2015-08-01 03:07:26 +0000","<a href=""http://twitter.com"" rel=""nofollow"">Twitter Web Client</a>","If a charge was created via the API w/ no note describing it then the alert email wouldn't get sent to the user. #bugfix","","","",""
"626932827775307776","","","2015-07-31 01:50:08 +0000","<a href=""http://twitter.com"" rel=""nofollow"">Twitter Web Client</a>","Dropped the option in reminder settings for getting a reply, figuring now that it's a proper threaded reply who wouldn't want it. Simplify!","","","",""
"626637478426861568","","","2015-07-30 06:16:31 +0000","<a href=""http://twitter.com"" rel=""nofollow"">Twitter Web Client</a>","The email bot now gives proper threaded replies when you email data to it! (Churning through prereqs for our big reminders revamp...)","","","",""
"625641235496046592","","","2015-07-27 12:17:49 +0000","<a href=""http://twitter.com"" rel=""nofollow"">Twitter Web Client</a>","Long overdue cleanup of our http://t.co/BSB4dTXLFz page; mainly adding Support Czar, Chelsea Miller.","","","","http://beeminder.com/aboutus"
"625572970405060608","","","2015-07-27 07:46:33 +0000","<a href=""http://twitter.com"" rel=""nofollow"">Twitter Web Client</a>","In ""sign up/in"" dialog for some of the autodata integrations, the header was giving text specific to Sleep as Android integration. #bugfix","","","",""
"625572714120527872","","","2015-07-27 07:45:32 +0000","<a href=""http://twitter.com"" rel=""nofollow"">Twitter Web Client</a>","Our @Jawbone goal creation wasn't giving you the option for an initial week of safety buffer. #bugfix","","","",""
"624824591190364160","","","2015-07-25 06:12:45 +0000","<a href=""http://twitter.com"" rel=""nofollow"">Twitter Web Client</a>","Second @rescuetime improvement: Sub-category minding! Some middle ground btwn minding a specific app &amp;, eg, the entire ""Business"" category.","","","",""
"624824494419390464","","","2015-07-25 06:12:22 +0000","<a href=""http://twitter.com"" rel=""nofollow"">Twitter Web Client</a>","2 @rescuetime UVIs today: we had a bug where we didn't let you correct the key if there was a problem. Now we show an error message. #bugfix","","","",""
"624138027883851776","","","2015-07-23 08:44:36 +0000","<a href=""http://twitter.com"" rel=""nofollow"">Twitter Web Client</a>","Got rid of sadreset in @Jawbone, meaning that when you create a new goal and we import your data, you can actually adjust xmin and view it.","","","",""
"624137874468810754","","","2015-07-23 08:43:59 +0000","<a href=""http://twitter.com"" rel=""nofollow"">Twitter Web Client</a>","Oops, inverted which deadlines can be set, which can't #bugfix + We're now consistent in referring to ""derailing"" rather than ""losing"" #mini","","","",""
"623762975350878208","","","2015-07-22 07:54:16 +0000","<a href=""http://twitter.com"" rel=""nofollow"">Twitter Web Client</a>","Night Owls, you can now customize deadlines for @duolingo goals. Thanks @wycats for keeping on us this whole time! (We clearly need that.)","","","",""
"623413753049026560","","","2015-07-21 08:46:35 +0000","<a href=""http://twitter.com"" rel=""nofollow"">Twitter Web Client</a>","New stat in the Stats box in sidebar of goal page: ""90% Variance"" which is actually a 90% quantile on... well, see http://t.co/eYG0nuEKLz","","","","http://beeminder.com/faq#qvar"
"622996398137548800","","","2015-07-20 05:08:10 +0000","<a href=""http://twitter.com"" rel=""nofollow"">Twitter Web Client</a>","Rare bug w/ blank pledge caps (involved a double-save on goal setup) caused us not to send legit check #mini #bugfix &amp; emailed ppl affected","","","",""
"622668479749959680","","","2015-07-19 07:25:08 +0000","<a href=""http://twitter.com"" rel=""nofollow"">Twitter Web Client</a>","If there was an auth error with your GmailZero token, we were only adding a 0 datapoint, not telling you it's broken. #bugfix","","","",""
"622296611754881024","","","2015-07-18 06:47:28 +0000","<a href=""http://twitter.com"" rel=""nofollow"">Twitter Web Client</a>","We were double-counting certain closed issues in Gitminder #bugfix (ie, issues closed betw midnight &amp; autodata fetch shortly after midnight)","","","",""
