"tweet_id","in_reply_to_status_id","in_reply_to_user_id","timestamp","source","text","retweeted_status_id","retweeted_status_user_id","retweeted_status_timestamp","expanded_urls"
"264107873297129472","","","2012-11-01 20:53:18 +0000","<a href=""http://twitter.com"" rel=""nofollow"">Twitter Web Client</a>","RT @bmndr: Beemind Your NaNoWriMo Progress: http://t.co/CaGZH97i #nanowrimo","264086297239486465","121250669","2012-11-01 19:27:34 +0000","http://j.mp/Q9iNXI,http://j.mp/Q9iNXI"
"263558823577542656","","","2012-10-31 08:31:34 +0000","<a href=""http://twitter.com"" rel=""nofollow"">Twitter Web Client</a>","API auth token accessible in account settings (My Account -&gt; Profile). HT @scottkrager","","","",""
"263557840772411392","","","2012-10-31 08:27:40 +0000","<a href=""http://twitter.com"" rel=""nofollow"">Twitter Web Client</a>","Fixed and improved @chirpify integration! Delighted that so many people noticed right away. Was actually 2 separate bugs by us and Chirpify!","","","",""
"263083181027258370","","","2012-10-30 01:01:32 +0000","<a href=""http://twitter.com"" rel=""nofollow"">Twitter Web Client</a>","Random taglines back on top of http://t.co/QATgbpNm with a few new additions like ""Odyssean goal tracking"", ""Be mindful of your goals"", etc","","","","http://beeminder.com"
"263054637693825024","","","2012-10-29 23:08:07 +0000","<a href=""http://twitter.com"" rel=""nofollow"">Twitter Web Client</a>","Bug fix in breadcrumb navigation if you were on a goal page that wasn't your own (on beeminder/alice/foo would link to beeminder/you/foo)","","","",""
"263022757481172992","","","2012-10-29 21:01:26 +0000","<a href=""http://twitter.com"" rel=""nofollow"">Twitter Web Client</a>","RT @bmndr: Beeminder â™¥ @trello: http://t.co/Bn2BSP1t (announcing Trello integration). On Hacker News: http://t.co/W3zGMI3S","263020079527120896","121250669","2012-10-29 20:50:48 +0000","http://j.mp/Q2zaWe,http://j.mp/RjokWI,http://j.mp/Q2zaWe,http://j.mp/RjokWI"
"262994125723426816","","","2012-10-29 19:07:40 +0000","<a href=""http://twitter.com"" rel=""nofollow"">Twitter Web Client</a>","Made years show up on x-axis for graphs w/ more than a year of data; bare min to get back on the road added to emergency day reminder emails","","","",""
"262084333806952448","","","2012-10-27 06:52:29 +0000","<a href=""http://twitter.com"" rel=""nofollow"">Twitter Web Client</a>","Fixed a bug where changing your goal date when inside the akrasia horizon made it flatten the road back to last dialing.  HT @jmillikin","","","",""
"261926023090810880","","","2012-10-26 20:23:24 +0000","<a href=""http://twitter.com"" rel=""nofollow"">Twitter Web Client</a>","Single biggest UVI tweet ever: Android app -- https://t.co/Fzn4bqvG -- and iPhone app -- https://t.co/JaVAvW0P -- officially launched!","","","","https://play.google.com/store/apps/details?id=com.beeminder.beeminder,https://itunes.apple.com/us/app/beeminder/id551869729"
"261537360766976001","","","2012-10-25 18:39:00 +0000","<a href=""http://twitter.com"" rel=""nofollow"">Twitter Web Client</a>","Fixed some mainly cosmetic glitches with the new goal form: https://t.co/2B2Nmvx1 &amp; https://t.co/e3qU2EWZ (more awesmness frm @andrewpbrett)","","","","https://trello.com/c/vDRlKe0m,https://trello.com/c/p3jLkc66"
"261536461088755712","","","2012-10-25 18:35:26 +0000","<a href=""http://twitter.com"" rel=""nofollow"">Twitter Web Client</a>","Bugfix: road dial on the reset page was not updating when you adjusted the values (nice catch by @andrewpbrett)","","","",""
"261536079922991105","","","2012-10-25 18:33:55 +0000","<a href=""http://twitter.com"" rel=""nofollow"">Twitter Web Client</a>","This tweet is officially the last time we're counting a blog post as a UVI. http://t.co/zxezvVMP (too many uvis; nice problem to have!)","","","","http://blog.beeminder.com/tv"
"260855467973160961","","","2012-10-23 21:29:24 +0000","<a href=""http://twitter.com"" rel=""nofollow"">Twitter Web Client</a>","Bugfix with new goal form where changing from Set A Limit to another goal type would hide road dial fields","","","",""
"260855227312398337","","","2012-10-23 21:28:27 +0000","<a href=""http://twitter.com"" rel=""nofollow"">Twitter Web Client</a>","Bugfix: emails for pending deletion of temporary test goals were going out even if the goal was already 86'd. HT https://t.co/CGiDMf44","","","","https://plus.google.com/102213224580869682674/posts"
"260853130655309825","","","2012-10-23 21:20:07 +0000","<a href=""http://twitter.com"" rel=""nofollow"">Twitter Web Client</a>","Various other tweaks to the new goal wizard like picking ""pledge now"" just goes ahead and moves you into the contract form on the goal","","","",""
"259922292853858305","","","2012-10-21 07:41:18 +0000","<a href=""http://twitter.com"" rel=""nofollow"">Twitter Web Client</a>","Nfor1: Simplified goal creation form, informs you immediately of any naming conflicts, smart defaults based on goal type, and much prettier!","","","",""
"259921662638714880","","","2012-10-21 07:38:48 +0000","<a href=""http://twitter.com"" rel=""nofollow"">Twitter Web Client</a>","RT @bmndr: Just fixed a serious bug with Set-A-Limit goals (they always started flat, obviously way too harsh!) thanks to @manooh","259921297721671680","121250669","2012-10-21 07:37:21 +0000",""
"259817808647565314","","","2012-10-21 00:46:07 +0000","<a href=""http://twitter.com"" rel=""nofollow"">Twitter Web Client</a>","Bugfix with avatar uploads. Still may have problems so please let us know if you spot any! HT @jzh77","","","",""
"259549344380899328","","","2012-10-20 06:59:20 +0000","<a href=""http://twitter.com"" rel=""nofollow"">Twitter Web Client</a>","Hovering over your current profile picture shows link to upload a new one (formerly known as avatars which wasn't so normal-person friendly)","","","",""
"259050188054884352","","","2012-10-18 21:55:52 +0000","<a href=""http://twitter.com"" rel=""nofollow"">Twitter Web Client</a>","After you re-rail, your graph keeps your previous yellow brick road history on the main graph (option to show *less* again coming soon!)","","","",""
"258038555685830656","","","2012-10-16 02:56:00 +0000","<a href=""http://twitter.com"" rel=""nofollow"">Twitter Web Client</a>","Typos/bugfixes/updates, eg ""dial up"" -&gt; ""down"" for weight gain goals, subtle bug w/ sending 1-of-3 of date/goal/rate in API, blog updates","","","",""
"258037948216401921","","","2012-10-16 02:53:35 +0000","<a href=""http://twitter.com"" rel=""nofollow"">Twitter Web Client</a>","Goals returned by API sorted by urgency, like website but ignore front/backburner status unless explicitly use ""filter"" to fetch 1 or other","","","",""
"257707239459147776","","","2012-10-15 04:59:28 +0000","<a href=""http://twitter.com"" rel=""nofollow"">Twitter Web Client</a>","RT @bmndr: Happy First Birthday to Beeminder! http://t.co/VhbnKdJs","257632900156096514","121250669","2012-10-15 00:04:04 +0000","http://j.mp/Pw1cJb,http://j.mp/Pw1cJb"
"256478981598093313","","","2012-10-11 19:38:49 +0000","<a href=""http://twitter.com"" rel=""nofollow"">Twitter Web Client</a>","For your 1st goal we now skip the pledging part of the wizard by default; wasn't jibing w/ how we describe things at http://t.co/E9UUotGf","","","","http://beeminder.com/money"
"255907203519766528","","","2012-10-10 05:46:46 +0000","<a href=""http://twitter.com"" rel=""nofollow"">Twitter Web Client</a>","Now you can extend your goal when it is about to end (goal date &lt; akrasia horizon); if goal date is past you've gotta do the reset dance tho","","","",""
"254377927108612096","","","2012-10-06 00:29:58 +0000","<a href=""http://twitter.com"" rel=""nofollow"">Twitter Web Client</a>","Since folks *still* were misinterpreting the ""shove below the fold"" feature we tweaked the icons. Now they're little minuses and pluses.","","","",""
"254336402496557057","","","2012-10-05 21:44:58 +0000","<a href=""http://twitter.com"" rel=""nofollow"">Twitter Web Client</a>","Fixed big problem with resets if 1) the old goal date was in the past &amp; 2) you reset with a flat road. Should be fewer hiccups on reset now!","","","",""
"254332744295923713","","","2012-10-05 21:30:26 +0000","<a href=""http://twitter.com"" rel=""nofollow"">Twitter Web Client</a>","UVI2for1: recent-data box on unfreeze used to keep saying 'derailed' till refresh; fixed serious ugliness w/ user gallery &amp; goals in firefox","","","",""
"254290355602739200","","","2012-10-05 18:41:59 +0000","<a href=""http://twitter.com"" rel=""nofollow"">Twitter Web Client</a>","CSS error made it impossible to select chirpify option on new contract! (cd still click the label, but I guess most ppl don't think of that)","","","",""
"254017927408390146","","","2012-10-05 00:39:27 +0000","<a href=""http://twitter.com"" rel=""nofollow"">Twitter Web Client</a>","New goal fields in the API -- http://t.co/qevyNy9Z -- plus documentation of the 4 fundamental goal types: PHAT, MOAR, WEEN, and RASH","","","","http://beeminder.com/api"
"253946124782690304","","","2012-10-04 19:54:08 +0000","<a href=""http://twitter.com"" rel=""nofollow"">Twitter Web Client</a>","Bugfix: When creating a Set-a-Limit goal just ask for generous estimate of your current rate instead of a messed up version of the road dial","","","",""
"253944668251885569","","","2012-10-04 19:48:21 +0000","<a href=""http://twitter.com"" rel=""nofollow"">Twitter Web Client</a>","Fixed longstanding bug with how the thin yellow guidelines on the good side of the yellow brick road are drawn","","","",""
"253714880773881856","","","2012-10-04 04:35:16 +0000","<a href=""http://twitter.com"" rel=""nofollow"">Twitter Web Client</a>","RT @bmndr: New on @bmndr blog: The One Must-Do Task Each Day. Ingeniously simple productivity scheme IMHO! http://t.co/bqPBMcQl &amp; ht ...","253513579247058944","121250669","2012-10-03 15:15:22 +0000","http://j.mp/POTshn,http://j.mp/POTshn,http://j.mp/UbLCo4"
"253391195005394944","","","2012-10-03 07:09:03 +0000","<a href=""http://twitter.com"" rel=""nofollow"">Twitter Web Client</a>","Updates to http://t.co/GnHKK7Ua &amp; http://t.co/te6majZr (image of road dial) &amp; http://t.co/wpIfF0rN &amp; http://t.co/JkcLm8fj (how do i delete)","","","","http://blog.beeminder.com/synonyms,http://blog.beeminder.com/dial,http://blog.beeminder.com/gym,http://beeminder.com/faq"
"252453050181095425","","","2012-09-30 17:01:12 +0000","<a href=""http://twitter.com"" rel=""nofollow"">Twitter Web Client</a>","RT @bmndr: New blog post, sort of piling on the @mongodb hatefest: Destroy All! http://t.co/Q3guRQ7P","252426373807869952","121250669","2012-09-30 15:15:12 +0000","http://j.mp/PC8PcM,http://j.mp/PC8PcM"
"251916724956442624","","","2012-09-29 05:30:02 +0000","<a href=""http://twitter.com"" rel=""nofollow"">Twitter Web Client</a>","Prettier road dial! And, sorry Picard fans, replaced MAKEITSO with DIAL-IT-IN. Thanks again to JX Bell.","","","",""
"251741579310678016","","","2012-09-28 17:54:04 +0000","<a href=""http://twitter.com"" rel=""nofollow"">Twitter Web Client</a>","Uncheck all days of week in reminder settings bt lv sms or email reminders on; u'll get warned when u're orange or red http://t.co/wpgwHs85","","","","http://beeminder.uservoice.com/forums/3011-general/suggestions/2293507-turn-off-bot-reminders-but-still-get-warnings-for-"
"251433672052461568","","","2012-09-27 21:30:33 +0000","<a href=""http://twitter.com"" rel=""nofollow"">Twitter Web Client</a>","Creditcard forms just got clingier: have to explicitly reject them if you want to abandon your changes (should be consistent everywhere now)","","","",""
"251403699178590208","","","2012-09-27 19:31:27 +0000","<a href=""http://twitter.com"" rel=""nofollow"">Twitter Web Client</a>","Placeholder text in data entry box now has today's day-of-month; + better initial text for autogenerated initial datapt http://t.co/fkf0ajcS","","","","http://beeminder.uservoice.com/forums/3011-general/suggestions/2749419-put-the-curent-date-in-the-placeholder-text-for-ne"
"251198925271363584","","","2012-09-27 05:57:45 +0000","<a href=""http://twitter.com"" rel=""nofollow"">Twitter Web Client</a>","Bugfix (part of improving Submit buttons, which we may or may not tweet separately): form wdn't let u update credit card info! HT @thylacine","","","",""
"250452982179708928","","","2012-09-25 04:33:38 +0000","<a href=""http://twitter.com"" rel=""nofollow"">Twitter Web Client</a>","Squashed an insidious little bug where some datapoints' dates wd increment when you edited them. HT @lady_alys @muflax https://t.co/0MJX2MFl","","","","https://twitter.com/thatgirl/status/250349284602544128"
"249564709131534337","","","2012-09-22 17:43:58 +0000","<a href=""http://twitter.com"" rel=""nofollow"">Twitter Web Client</a>","Added Uluc to our About page -- http://t.co/Bquws4V7 -- and fixed that rounding thing for real (HT @Pruneau).","","","","http://beeminder.com/aboutus"
"249562808080011264","","","2012-09-22 17:36:24 +0000","<a href=""http://twitter.com"" rel=""nofollow"">Twitter Web Client</a>","RT @bmndr: New blog post about Gmail Zero: Beeminding Your Inbox -- http://t.co/HECrogla (with source code and everything) cc @dyang","249527266219016193","121250669","2012-09-22 15:15:10 +0000","http://j.mp/TgiNGR,http://j.mp/TgiNGR"
"249281442960519168","","","2012-09-21 22:58:22 +0000","<a href=""http://twitter.com"" rel=""nofollow"">Twitter Web Client</a>","Removed settings for ""good side of the road"" and ""direction of road"" except for custom goals. Was too easy to bork your graph with those.","","","",""
"249214106995937280","","","2012-09-21 18:30:47 +0000","<a href=""http://twitter.com"" rel=""nofollow"">Twitter Web Client</a>","One more: weight loss roads are now explicit, not sneaky, in imposing an initial week of flat spot. Big thx to A, who wishes to remain anon.","","","",""
"249188021306548224","","","2012-09-21 16:47:08 +0000","<a href=""http://twitter.com"" rel=""nofollow"">Twitter Web Client</a>","Also: typeahead slug suggestions; ""start flat?"" checkbox like for unfreezing; pledging as optional part of goal creation; ... #compoundUVI","","","",""
"249184614625734656","","","2012-09-21 16:33:36 +0000","<a href=""http://twitter.com"" rel=""nofollow"">Twitter Web Client</a>","Also thx to @darickdang (the wizard doesn't currently showcase much of his design work so he may be embarrassed to be associated w/ this :))","","","",""
"249184467028148224","","","2012-09-21 16:33:01 +0000","<a href=""http://twitter.com"" rel=""nofollow"">Twitter Web Client</a>","New goal creation wizard entails myriad improvements, not least of which is that you can start creating a goal before signing up.","","","",""
"249182475601989632","","","2012-09-21 16:25:06 +0000","<a href=""http://twitter.com"" rel=""nofollow"">Twitter Web Client</a>","Nicer, wizard-like goal creation process. Hooray @upstartlabs, @jennlynch, @andrewpbrett!","","","",""
"248901247233556480","","","2012-09-20 21:47:36 +0000","<a href=""http://twitter.com"" rel=""nofollow"">Twitter Web Client</a>","RT @bmndr: We're moving to @trello to track our TODOs and all our boards are wide open to the public: http://t.co/eXJZEg3T","248900791098810368","121250669","2012-09-20 21:45:47 +0000","http://j.mp/P3UlSN,http://j.mp/P3UlSN"
"248549833567244288","","","2012-09-19 22:31:12 +0000","<a href=""http://twitter.com"" rel=""nofollow"">Twitter Web Client</a>","Watermark on graph now just ""eep!"" on emergency days instead of like ""-1"" + tweaks to error message wording + rounding fix (HT @cyberroland)","","","",""
"248267155337007106","","","2012-09-19 03:47:57 +0000","<a href=""http://twitter.com"" rel=""nofollow"">Twitter Web Client</a>","New reminder setting to turn off the emails the bot sends back saying your graph is updated (the ones w/ the random fitness tips) HT @gwern","","","",""
"247926059125841921","","","2012-09-18 05:12:33 +0000","<a href=""http://twitter.com"" rel=""nofollow"">Twitter Web Client</a>","Made the road dial less opaque/confusing: clicking on a grayed out field ungrays it. Hooray @andrewpbrett","","","",""
"246757173437272064","","","2012-09-14 23:47:49 +0000","<a href=""http://twitter.com"" rel=""nofollow"">Twitter Web Client</a>","API bugfix: broke something a few days ago with the ""specify exactly 2 of goal date, goal value, rate"" requirement. HT @MrJavaGuy","","","",""
"246679622316605440","","","2012-09-14 18:39:39 +0000","<a href=""http://twitter.com"" rel=""nofollow"">Twitter Web Client</a>","RT @bmndr: New blog post: Failing your Goals with Beeminder (guest post on Anki and Habitualization by Paul Fenwick (@pjf)): http://t.co ...","246673189005049858","121250669","2012-09-14 18:14:05 +0000","http://j.mp/Q8GmLg"
"246000878736257024","","","2012-09-12 21:42:34 +0000","<a href=""http://twitter.com"" rel=""nofollow"">Twitter Web Client</a>","We implemented this for real now -- you can change your rate units (daily, weekly, monthly, etc) for any kind of graph any time. HT @muflax","","","",""
"245385718321512448","","","2012-09-11 04:58:08 +0000","<a href=""http://twitter.com"" rel=""nofollow"">Twitter Web Client</a>","Couple cornercase bugfixes in the API, plus various updates to old blog posts, like new road dial image at http://t.co/te6majZr","","","","http://blog.beeminder.com/dial"
"245380257618722816","","","2012-09-11 04:36:27 +0000","<a href=""http://twitter.com"" rel=""nofollow"">Twitter Web Client</a>","For weight loss graphs starting on or after today (sep 10): yellow brick road starts at the max of the first 7 datapoints (instead of 3)","","","",""
"245306774448640000","","","2012-09-10 23:44:27 +0000","<a href=""http://twitter.com"" rel=""nofollow"">Twitter Web Client</a>","Bugfix: the Save Changes button wouldn't become enabled if you just made changes in your fine print (text area). HT @Pruneau &amp; @WBoerger","","","",""
"244659966387048448","","","2012-09-09 04:54:16 +0000","<a href=""http://twitter.com"" rel=""nofollow"">Twitter Web Client</a>","Bugfixes: bad things happened if you tried to name a goal ""new""; some api auth errors didn't give nice json responses (HT Tom Jack of @loku)","","","",""
"244599905258184704","","","2012-09-09 00:55:36 +0000","<a href=""http://twitter.com"" rel=""nofollow"">Twitter Web Client</a>","You can now change your rate units in advanced settings for custom goals (only for newly created goals with flat roads though!); HT @muflax","","","",""
"244400840985677824","","","2012-09-08 11:44:35 +0000","<a href=""http://twitter.com"" rel=""nofollow"">Twitter Web Client</a>","Terms of Service written by actual lawyers. Try to contain your excitement. https://t.co/IIGz0hEf (Huge thanks to @wordpress/@automattic)","","","","https://www.beeminder.com/legalschmegal"
"244145068880048128","","","2012-09-07 18:48:15 +0000","<a href=""http://twitter.com"" rel=""nofollow"">Twitter Web Client</a>","Got rid of username endpoint in API. Thx to @klochner and @jmillikin for pointing out better ways to get username, both of which we now do.","","","",""
"243470701875585024","","","2012-09-05 22:08:33 +0000","<a href=""http://twitter.com"" rel=""nofollow"">Twitter Web Client</a>","The API and blog post about it count as 2 UVIs. As a bonus, there's bsoule's pushup video in the hacker news comments: http://t.co/GlAcjyvc","","","","http://news.ycombinator.com/item?id=4480056"
"243257681320751104","","","2012-09-05 08:02:05 +0000","<a href=""http://twitter.com"" rel=""nofollow"">Twitter Web Client</a>","It's official! API open to the public: http://t.co/qevyNy9Z and blog post announcing it at http://t.co/mjMVoLAP","","","","http://beeminder.com/api,http://blog.beeminder.com/api"
"241962027709509632","","","2012-09-01 18:13:37 +0000","<a href=""http://twitter.com"" rel=""nofollow"">Twitter Web Client</a>","Patched a security hole in the API, thanks to @jmillikin. Thanks to him and others for hammering on it this weekend before we announce it!","","","",""
"241746792260194305","","","2012-09-01 03:58:21 +0000","<a href=""http://twitter.com"" rel=""nofollow"">Twitter Web Client</a>","In honor of John Hunter, who died this week, we finally fully flipped the switch to all matplotlib graphs. http://t.co/KkXEpOya","","","","http://news.ycombinator.com/item?id=4452731"
"241743189759913984","","","2012-09-01 03:44:02 +0000","<a href=""http://twitter.com"" rel=""nofollow"">Twitter Web Client</a>","Two improvements in particular: bull's eye only shows up if your goal date is within 2 weeks, and graphs generate slightly faster.","","","",""
"241673253205209088","","","2012-08-31 23:06:08 +0000","<a href=""http://twitter.com"" rel=""nofollow"">Twitter Web Client</a>","Cleaned up New Goal form a bit. Got rid of goal types no one used (available now via Custom anyway) and improved descriptions.","","","",""
"241286978262425600","","","2012-08-30 21:31:13 +0000","<a href=""http://twitter.com"" rel=""nofollow"">Twitter Web Client</a>","It's finally possible to fully customize a goal created as ""custom"", though we recommend most people stick with Do More goals. Next up: API!","","","",""
"240706999740952576","","","2012-08-29 07:06:35 +0000","<a href=""http://twitter.com"" rel=""nofollow"">Twitter Web Client</a>","Various style tweaks, consistent buttons, little cog icon on Settings tab. Also: several improvements to http://t.co/JkcLm8fj HT @jmmason","","","","http://beeminder.com/faq"
"240706701391716352","","","2012-08-29 07:05:24 +0000","<a href=""http://twitter.com"" rel=""nofollow"">Twitter Web Client</a>","Redirect to your goal page on re-rail instead of, confusingly, your goal gallery. Also: got rid of RunKeeper options for weightloss goals.","","","",""
"240530031644905472","","","2012-08-28 19:23:23 +0000","<a href=""http://twitter.com"" rel=""nofollow"">Twitter Web Client</a>","Improved last night's half-assed implementation of facebook-style Save buttons, including a warning if you navigate away w/o saving changes","","","",""
"240341613937840128","","","2012-08-28 06:54:40 +0000","<a href=""http://twitter.com"" rel=""nofollow"">Twitter Web Client</a>","Inspired by how facebook does submit/save buttons, we now disable them until there's something to actually submit/save","","","",""
"239913259292045313","","","2012-08-27 02:32:33 +0000","<a href=""http://twitter.com"" rel=""nofollow"">Twitter Web Client</a>","Glitchfix w/ pagination buttons in data tab, and got rid of superfluous headers on Edit and Delete columns. Soo close on announcing new api!","","","",""
"239613769536372736","","","2012-08-26 06:42:29 +0000","<a href=""http://twitter.com"" rel=""nofollow"">Twitter Web Client</a>","TagTime now uses the new soon-to-be-announced @bmndr api, and only sends Beeminder data that's actually changed. cc @tagtm","","","",""
"239238541127843840","","","2012-08-25 05:51:27 +0000","<a href=""http://twitter.com"" rel=""nofollow"">Twitter Web Client</a>","New advanced setting makes your data public (off by default). OSX dashboard widget works better this way too! http://t.co/SgTOa6KR HT @kubla","","","","http://blog.beeminder.com/widget"
"238888688912846848","","","2012-08-24 06:41:16 +0000","<a href=""http://twitter.com"" rel=""nofollow"">Twitter Web Client</a>","New ""weasel-proof me"" box in advanced settings: check it if you think we're too soft on you when you reply to legit-check emails w/ excuses","","","",""
"238516231265714176","","","2012-08-23 06:01:15 +0000","<a href=""http://twitter.com"" rel=""nofollow"">Twitter Web Client</a>","RT @bmndr: New blog post: Beeminder is S.M.A.R.T., Overcomes Bias. http://t.co/Lh3zrkfM HT @katjagrace again","238516149191581696","121250669","2012-08-23 06:00:56 +0000","http://blog.beeminder.com/smart,http://blog.beeminder.com/smart"
"238156770726522881","","","2012-08-22 06:12:53 +0000","<a href=""http://twitter.com"" rel=""nofollow"">Twitter Web Client</a>","Closed an information leak where we 404'd if you asked for a nonexistent goal, but redirected/scolded you if you asked for a secret goal","","","",""
"237789773031424000","","","2012-08-21 05:54:34 +0000","<a href=""http://twitter.com"" rel=""nofollow"">Twitter Web Client</a>","Comments now truncated properly in Recent Data; Also: mouseovers now consistent between road dial under the graph and in new goal form","","","",""
"237419769584820224","","","2012-08-20 05:24:18 +0000","<a href=""http://twitter.com"" rel=""nofollow"">Twitter Web Client</a>","Glitchfix: don't let long goal titles wrap behind the goal nav tabs. Also: RunKeeper goals were not staying frozen after derailments.","","","",""
"237080810023424000","","","2012-08-19 06:57:24 +0000","<a href=""http://twitter.com"" rel=""nofollow"">Twitter Web Client</a>","RT @bmndr: New blog post: Perverse Incentives and the Paradox of Beeminder's Sting. http://t.co/0JwtKT1Q","237080706633846784","121250669","2012-08-19 06:56:59 +0000","http://blog.beeminder.com/perverse,http://blog.beeminder.com/perverse"
"236696370961084416","","","2012-08-18 05:29:47 +0000","<a href=""http://twitter.com"" rel=""nofollow"">Twitter Web Client</a>","Fixed misaligned delete buttons in the Data tab (Bootstrap css was interfering with our homespun css)","","","",""
"236328818300833792","","","2012-08-17 05:09:15 +0000","<a href=""http://twitter.com"" rel=""nofollow"">Twitter Web Client</a>","Bugfix: if you revoked bmndr's permission &lt;sniff&gt; to access your Gmail or RunKeeper then we weren't showing that in My Account -&gt; Services","","","",""
"235983471477137408","","","2012-08-16 06:16:58 +0000","<a href=""http://twitter.com"" rel=""nofollow"">Twitter Web Client</a>","Cleaned up the FAQ -- http://t.co/JkcLm8fj -- and added new questions, about ""buzzing off"" and derailing due to random fluctuation.","","","","http://beeminder.com/faq"
